{
  "schemaVersion": 1,
  "id": "dish_permission-ladder-publish_codex-sol-high_20260814214953107_254ced58",
  "recipe": {
    "id": "permission-ladder-publish",
    "version": "1.0.0",
    "hash": "sha256:8162824c69be6e1dfa98dfca69ecc580c29738794b8d4847f66e31736c6bba3c"
  },
  "executedAt": "2026-08-14T21:49:53.107Z",
  "finalizedAt": "2026-08-14T21:50:41.551Z",
  "identity": {
    "variantId": "codex-sol-high",
    "provider": "openai",
    "requestedModel": "gpt-5.6-sol",
    "observedModel": "gpt-5.6-sol",
    "harness": "codex-cli",
    "harnessVersion": "codex-cli 0.145.0",
    "reasoningEffort": "high",
    "serviceTier": "default",
    "requestedServiceTier": "default",
    "observedServiceTier": "default",
    "configHash": "sha256:9907d5ced07fcc82917dd925cf7de69a26a3eeb4e36eae3aacf41f3efacf945a",
    "catalogHash": "sha256:f6ed1a4109af0560c6261ea50f6e92abc4c4cbfab96c2159ac6db5081300fa08"
  },
  "status": "accepted",
  "artifact": {
    "kind": "session",
    "entry": "artifact/output/session.json",
    "files": [
      {
        "path": "artifact/output/session.json",
        "sha256": "a580d86af36f6cb9cb8e9ed884880ef880dd7e846447e4a23d17c557655041ea",
        "bytes": 3379
      }
    ],
    "treeHash": "sha256:2a1613b2d29ccbc610d3b2f70a29e263d78129fb5c5e53f76aa977f853f352dc"
  },
  "validation": {
    "passed": true,
    "report": "validation.json"
  },
  "publicTrace": "trace.json",
  "dishHash": "sha256:6b5c67f5e760e92335286554df68af5104ebcf091c5aed5c5afc7f393ca876ea"
}
