{
  "schemaVersion": 1,
  "id": "dish_shared-result-ritual_codex-terra-high_20260814215047426_c82000ae",
  "recipe": {
    "id": "shared-result-ritual",
    "version": "1.0.0",
    "hash": "sha256:7ea2e47fb18b50d7d11dcac27605e6fea82e5120fe9b3bd062a03736ef661dd7"
  },
  "executedAt": "2026-08-14T21:50:47.426Z",
  "finalizedAt": "2026-08-14T21:58:03.598Z",
  "identity": {
    "variantId": "codex-terra-high",
    "provider": "openai",
    "requestedModel": "gpt-5.6-terra",
    "observedModel": "gpt-5.6-terra",
    "harness": "codex-cli",
    "harnessVersion": "codex-cli 0.145.0",
    "reasoningEffort": "high",
    "serviceTier": "default",
    "requestedServiceTier": "default",
    "observedServiceTier": "default",
    "configHash": "sha256:723f9136a0fe65cea9092c2125dda2ee6388d3bb3b7ad4c338fb0fd5b8db2879",
    "catalogHash": "sha256:f6ed1a4109af0560c6261ea50f6e92abc4c4cbfab96c2159ac6db5081300fa08"
  },
  "status": "accepted",
  "artifact": {
    "kind": "web",
    "entry": "artifact/index.html",
    "files": [
      {
        "path": "artifact/index.html",
        "sha256": "28706ee4924e6ebf04afeb047ebad01e13fd752d614e9b9bb3a5c3c691c5c276",
        "bytes": 17815
      }
    ],
    "treeHash": "sha256:0fe4105ce913ecbb4d2d68125978bad3995b3c894920f66f6a797cef089c3bc9"
  },
  "validation": {
    "passed": true,
    "report": "validation.json"
  },
  "publicTrace": "trace.json",
  "dishHash": "sha256:a0d77cd05e3a4edb42b1028cc64679f64837ebfba8384f9952114d5db8c47a4b"
}
